youre looking magnificent leon isnt he general savitzky,3
general please if you hear any rumors that i am a charitable person will you please kill them at their source,3
they hope the settlement will bring you a fortune,3
are they indeed thank you,3
i want you to know all the white russian exiles in paris are keeping their fingers crossed about the jewels they are very interested in the case swana suspects her countrymen,3
yes general savitzky,3
your highness,3
thank you louis,3
is this satisfactory,3
thats perfect,3
only one in the rear im afraid,3
it is only a small table but it will be no trouble to put in some extra chairs,3
count dalgout,3
certainly your highness this way please count dalgout made the reservation this afternoon,3
good evening louis you seem to be very crowded tonight can you manage a table near the floor,3
good evening your highness,3
it is in the air it may come around the corner as you walk down the street,3
theres something in constantinople something irresistible,3
the russia of piroshki people will eat and love it,3
dont call it desertion our little restaurant that is our russia the russia of borscht the russia of beef stroganoff blinis with sour cream,3
ali baba and the forty thieves into one single hour you can crowd a thousand and one nights,3
ninotchka we are in the magic east the country of aladdin and his lamp,3
that was our idea when we first came all we thought we would get out of this trip was a turkish bath but we learned better,3
thank you for a wonderful dinner,3
well i think its getting late good night ninotchka,3
so it blows up that big what they call an omelette surprise,3
des petites fraises des bois de la cr???me de bretagne,3
if you close your eyes and listen to our voices we might be in paris,3
its a real paris reunion,3
lets do that,3
while you eat you look at the view,3
they tell me it has a wonderful restaurant on the second floor,3
we avoided luxury and extravagance and today well if you were to offer us a glass of champagne we wouldnt say no,3
we dont blame you leon but when we came from russia we believed in simplicity,3
how can you find somebody without knowing what he looks like,3
this is a fine thing maybe weve missed him already,3
it is thursday,3
halt negotiations immediately envoy extraordinary arrives thursday six ten with full power your authority cancelled herewith razinin,3
oh leon you are so good,3
leon my little boy,3
what is it my boy,3
yes leon,3
soviet russia will put all its might behind this case,3
that wont help you you cant intimidate us,3
i give you my word they were confiscated legally,3
we can call our ambassador,3
these may have been the jewels of the duchess swana but like all private property they were confiscated by the state,3
you know monsieur mercier this is all nonsense,3
do we give the impression of people who are pressed for money,3
we can wait,3
he wouldnt say that what he would say is buljanoff you cant afford to live in a cheap hotel doesnt the prestige of the bolsheviks mean anything to you do you want to live in a hotel where you press for the hot water and cold water comes and when you press for the cold water nothing comes out at all phooey buljanoff,3
if lenin were alive he would say buljanoff comrade for once in your life youre in paris dont be a fool go in there and ring three times,3
i dont want to go to the hotel terminus,3
comrades if we ring nine times lets go in,3
they tell me when you ring once the valet comes in when you ring twice you get the waiter and do you know what happens when you ring three times a maid comes in a french maid,3
lets be honest have we anything like it in russia,3
comrades why should we lie to each other its wonderful,3
no no,3
you found your way to us and we werent easy to reach were we,3
i think she covered you with the parasites,3
what did she say about me,3
she says she wont be intimidated by parasites she called the duchess a bloodsucking aristocrat and a blackmailer,3
ill send you a muff,3
and if we have to go to siberia,3
razinin board of trade moscow,3
razinin,3
whats the name of that commissar on the board of trade,3
i just said lets have a little lunch room service,3
what proposition,3
oh no no i am not a highwayman im just a nuisance all im trying to do is make things as difficult as possible,3
i suppose you expect us to hand over the jewels,3
but how will she look the fashions this spring are very becoming to her gentlemen the judge will be french the jury will be french everybody in that courtroom will be french have you ever seen a french court when a beautiful woman sits on the witness stand and lifts her skirt a little you sit down and pull up your pants and where will it get you,3
all right go ahead get her on the witness stand what can she say,3
dont look so gloomy gentlemen all is not lost you may have a chance,3
get out of here,3
well gentlemen how about a little lunch,3
but you cant,3
i just want a word with monsieur mercier,3
if you want to see us you must come later,3
my name is count dalgout i telephoned,3
we dont want to be disturbed,3
you mean you are deserting russia,3
we have a wonderful electric sign dine with buljanof iranoff and kopalski,3
buljanoff she still has those old fashioned bolshevik ideas,3
youve done it again and i am responsible how can you forget yourselves this way you were sent here to make money not to spend it,3
now please ninotchka dont start figuring it out in cows,3
but buljanoff iranoff kopalski,3
look for yourselves,3
bad news,3
just three people in a room this size whew,3
only myself and two other girls one is a cello player in the opera and the other a streetcar conductor,3
brave thats right,3
come now you must not talk that way you have to adjust yourselves we must be brave,3
too bad we have to waste all that time,3
well it means another two weeks in paris,3
two thousand francs if i stay here a week i will cost the russian people seven cows who am i to cost the russian people seven cows,3
a cow,3
do you know how much a cow costs comrade iranoff,3
a day,3
a week,3
two thousand francs,3
how much does this cost,3
what a charming idea for moscow to surprise us with a lady comrade,3
comrade,3
comrade kopalski,3
comrade,3
comrade buljanoff,3
i am nina ivanovna yakushova envoy extraordinary acting under direct orders of comrade commissar razinin present me to your colleagues,3
i am michael simonovitch iranoff,3
i am looking for michael simonovitch iranoff,3
right away instantly,3
yes monsieur,3
a special envoy is coming from moscow hell occupy the royal suite move our things to the smallest room youve got,3
but gentlemen i am afraid,3
thats even better,3
im afraid we have no boxes of that size in our vault but there is one suite with a private safe,3
oh yes but have you a safe here big enough to hold this,3
i might be able to accommodate you is there some more luggage,3
monsieur,3
this is comrade kopalski,3
just looking around,3
yes monsieur,3
we cant but you are so ingenious leon,3
all right then make an appointment with her so i can see her,3
she doesnt leave her room she has been locked in for the last two days with lawyers and law books,3
well boys id like to help you but what can i do yesterday i waited six hours in the lobby,3
leon leonitchka she is not going to negotiate she is going to fight that injunction shes going to make a precedent of it,3
whats new,3
if we say that leon well be sent to siberia,3
how does this strike you commissar razinin board of trade moscow unexpected situation here duchess swana in paris claims jewels and has already brought injunction against sale or removal after long and careful study we suggest in the interest of our beloved country a fiftyfifty settlement as best solution iranoff buljanoff and kopalski,3
all right go ahead you talk to the lawyer and ill talk to the judge,3
we havent anything to discuss with you well talk to a lawyer,3
yes a very slim one i want to be fair i dont deny that you might make out some kind of a case,3
we may have a chance,3
just a moment i hope you havent closed this deal monsieur mercier it might bring you into serious difficulties,3
now monsieur you have no right,3
dont make it difficult for me this is no more a pleasure trip for me than it is for you,3
and kopalski,3
we will get that well get everything maybe a little bit later but well get it we must be patient finally we got the spring didnt we we got the swallows and you will get your apfel strudel too,3
yes a good piece of apfel strudel,3
now comrades there is something better in life than crumbs of french pastry,3
even the swallows are back,3
the same spring we had in paris just as good,3
and its great think what it was a few years ago and what it is now,3
yes theres no doubt of that just look out of the window and there it is,3
sssh once and for all were in moscow,3
and your own gas cooker thats marvelous naturally its not the royal suite,3
well were back home,3
how are you you three scoundrels,3
no not a thing would you like to go out,3
if there is anything we can do for you,3
oh yes power and light thank you,3
i acted on your suggestion and got in touch with the power and light authorities whenever you want to visit their plants they are open to you,3
you comrade iranoff go to the public library and get me the section of the civil code on property,3
yes comrade,3
we cannot feed the russian people on your intentions fifty per cent to a socalled duchess half of every loaf of bread to our enemy comrade kopalski go at once to our embassy and get the address of the best lawyer in paris,3
we did it with the best intentions,3
will you send me some cigarettes please comrades i am not in a position to pass final judgment but at best you have been careless in your duty to the state you were entrusted with more than a mere sale of jewelry why are we peddling our precious possessions to the world at this time our next years crop is in danger and you know it unless we can get foreign currency to buy tractors there will not be enough bread for our people and you three comrades,3
i will not repeat your mistake i will have no dealings with the grand duchess nor her representative,3
we dealt directly with the representative of the grand duchess i am sure if we call him he will give you a very clear picture,3
i hope so for your sake let us examine the case what does the lawyer say,3
we did our best comrade,3
i am ashamed to put the picture of lenin in a room like this comrades your telegram was received with great disfavor in moscow,3
its a hat comrade a womans hat,3
whats that,3
no thank you,3
allow me comrade,3
why why should you carry other peoples bags,3
he is a porter he wants to carry them,3
dont make an issue of my womanhood we are here for work all of us lets not waste time shall we go,3
if we had known we would have greeted you with flowers,3
au revoir,3
well leave these papers here for your further consideration au revoir madame,3
well theres nothing we can do about it why get excited,3
yes it is unfortunate,3
i know gentlemen but it is in the hands of the court were helpless arent we,3
we did our utmost to have it set ahead,3
thats two weeks from thursday,3
the hearing is set for the twentieth of this month,3
im sorry gentlemen the other day i heard such a funny story it still makes me laugh it is very funny i am sorry oh yes about this injunction,3
im sorry sir but i must insist,3
you want me to go in there,3
she has been asked to leave the powder room but without success we would appreciate if you would see to it yourself,3
what can i do about it,3
that kind of propaganda is bad anywhere but inciting the attendants of a powder room to go on strike well if she succeeds the consequences will be disastrous,3
give me another double brandy,3
suspicions nothing but suspicions thats the trouble with you if you dont let me in ill stand in front of this office of yours and warn people to keep away from russia ill picket your whole country,3
or a tunnel or a bridge,3
what for why,3
how do i know you dont want to blow up a factory,3
on what,3
why should i take a chance,3
now look here you advertise all over the world that you want people to go into your country and when someone tries to get in you keep him out,3
youre going to force us huh,3
thats impossible nobody has the right you cant do that if you dont give me that visa,3
oh no no visa,3
i must get into that country of yours,3
no visa,3
yes,3
so its love which drags you to moscow,3
i want to see a friend of mine a very dear friend its a personal matter which has nothing to do with politics or social philosophies its a girl,3
i think so too,3
listen i want to be absolutely frank with you i have no business in moscow,3
but you had,3
believe me i have no connection with her any longer i swear i havent,3
the grand duchess swana active in the white russian movement,3
she must have her little joke youre not going to take that seriously,3
you believe in our cause,3
on the contrary i dont want to have anything to do with them,3
are you sympathetic to the former czaristic government the white russians,3
confess what,3
there is no privacy in russia this whole thing seems very suspicious whats the real reason if you ever want to get into russia take my advice confess,3
private,3
what business,3
business,3
why should an aristocrat want to go to russia,3
dont hold that against me please,3
count leon dalgout a count a nobleman,3
heres my passport please give me a visa i have to leave for russia immediately,3
not always look at me ive been back twice,3
pardon me i am very interested in what you just said you mean when an envoy goes back to russia if they dont like what he has done they put him out of the way,3
well when it is a choice between my personal interest and the good of my country how can i waver no one shall say ninotchka was a bad russian,3
if you dont stay with me ill have to continue my fight ill travel wherever russian commissions are ill turn them all into buljanoffs iranoffs and kopalskis the world will be crowded with russian restaurants ill depopulate russia once you saved your country by going back this time you can save it by staying here,3
but leon i am only here for a few days,3
i wont tell you what came between ill prove it it will take a long time ninotchka at least a lifetime,3
the one i got they wouldnt let me read it began ninotchka my darling and ended yours leon,3
trying to keep me away from you it couldnt be done naturally i couldnt go on forever punching passport officials in the nose but i found a way didnt i darling i had to see you i wrote and wrote but all my letters came back,3
so youre behind all this i should have known,3
they wouldnt let me in so i had to get you out,3
so happy and so tired,3
yes sweetheart,3
comrades people of the world the revolution is on the march i know wars will wash over us bombs will fall all civilization will crumble but not yet please wait wait whats the hurry let us be happy give us our moment we are happy arent we leon,3
please,3
thank you leon thank you masses can i make a speech now,3
it is their wish,3
is this the wish of the masses,3
i give them back to the people i make you ninotchka the great duchess of the people grand duchess of the people,3
they belong to the people,3
come sweetheart let me put it on you you will teach these jewels for the first time they will learn how they can look,3
now darling dont get impatient wait until we are married you know that worthless butler of mine that reactionary some day when i come home to you i may say darling i drove gaston to the market and look what i got from him,3
czar peter gave it to his wife catherine the great for it he sold ten thousand serfs in the market,3
who cried that one,3
they are the tears of old russia see that stone,3
but big,3
it wouldnt be fair to the man in the street there they are they are terrible things those jewels,3
but i can throw it out of the window,3
there it is thursday you cant rip it out of the week,3
no no music,3
no music,3
well it has to warm up you have to give it a chance just like people like you and me first you wanted to fight me and now we belong to the same party salute,3
its dead,3
well then we turn twice to the right and stop at seven,3
yes sweetheart all by ourselves,3
no no news we dont want to know whats happening in the world we want to be left alone dont we,3
what shall we get the news,3
oh yes yes it has a little knob that turns a little knob it must be somewhere around here yes here i see,3
its a little box that you buy on the installment plan and before you tune it in they tell you they have a new model,3
radio what is radio,3
lets turn on the radio,3
i have paid the penalty now lets have some music,3
all right,3
much happier,3
would that make you any happier,3
everyone wants to confess and if they dont confess they make them confess i am a traitor when i kissed you i betrayed the russian ideal leon i should be stood up against the wall,3
i know its the russian soul,3
i am so happy no one can be so happy without being punished i will be punished and i should be punished i want to confess darling,3
yes a kiss salute,3
our salute will be a kiss,3
no no,3
and we wont clench our fist,3
no no,3
and we wont stretch up our arms,3
right lovers of the world unite,3
no dont lets have it any color no color just a house house lets form our own party,3
all right well make it red,3
not white darling,3
yes a little white house,3
are we going to build our little house,3
no nobody will find us,3
dont tell them where were going sweetheart,3
and i adore you ninotchua,3
i love you my little leonitchka,3
no speech,3
no speech,3
quite right yes yes yes but first youre going in that door and youre going to take a little spirits of ammonia and lie down,3
they are all duchesses here thousands of duchesses and i am going to tell them,3
now ninotchka please,3
comrades good people of france,3
but darling you cant do that,3
dont shush me i am people i want to make a speech i want to overthrow the duchess,3
shhh shhh,3
i must talk to my brothers,3
darling darling please,3
comrades comrades,3
yes dont worry everything will be all right,3
thursday,3
what darling,3
oh everything is so wonderful its getting farther and farther away,3
you just made that trip from goats to grapes a little too fast,3
oo darling something is the matter,3
to the loveliest story i ever heard,3
you must darling,3
wonderful if one could believe it,3
no darling ill tell you another story a much better one the only thing that will be over on thursday is the lawsuit there will be no thursday for us not next week or any week we wont let it happen ill tear it out of the calendar is that a good story,3
go on,3
well there were two scotchmen one was named mcintosh and one was named mcgillicuddy they met on the street,3
you never finished the one about the two scotchmen with the names,3
a funny story,3
quickly please tell me one of your funny stories,3
and general savitzky,3
how do you do,3
there have been cases but the headache the next morning is worth while if you drink it with the right toast to us ninotchka,3
from what i read i thought champagne was a strong drink its very delicate do people ever get drunk on this,3
from goats to grapes thats drinking in the right direction,3
its funny to look back i was brought up on goats milk i had a ration of vodka in the army and now champagne,3
its always good luck to launch something with champagne a battleship or an evening,3
i wouldnt know the closest i ever came to champagne was in a newsreel the wife of some president was throwing it at a battleship,3
my darling,3
leon dont ever ask me for a picture of myself i couldnt bear the thought of being shut up in a drawer i couldnt breathe i couldnt stand it,3
ninotchka youre jealous,3
i suppose she is very entertaining it must be lots of fun to be with her so witty so glamorous,3
ninotchka i love you,3
she is very attractive she has great elegance shes what you call a woman of the world isnt she,3
when i was here before i noticed a photograph of a woman on the desk in a wide silver frame i thought what a waste of silver thats all that interested me then now i would like to know what happened to the woman,3
i dont think so,3
did you make any change in this room,3
i promise i swear,3
if you dont want to answer you neednt but if you do you must tell me the truth,3
anything ninotchka,3
leon i would like to ask you something,3
leon i want to tell you something which i thought i never would say which i thought nobody ever should say because i thought it didnt exist and leon i cant say it,3
no go on,3
leon you know the jokes you told me a few days ago i wake up in the middle of the night and laugh at them now leon thats wrong i know theyre not funny theyre silly theyre stupid and still i laugh and when i look at buljanoff and iranoff and kopalski i know they are scoundrels and i should hate them then i realize who made them like that and instead of sending my report to moscow i tear it up and go down and buy a ridiculous hat and if this keeps on am i too talkative,3
you see i couldnt shout that,3
not radio lets have music thats just for ourselves,3
a wonderful idea radio or records,3
well first i should like to take off my hat and jacket then could we have some music,3
thats when one half of paris says to the other half what are your plans for this evening madame,3
its nine oclock,3
twelve seventyfive from the clarence the sonofagun made a detour but he got you here,3
for twelve francs seventyfive,3
you see life can be so simple,3
ive never been here before i wonder whom youre thinking of oh i know a girl with a map figuring out each step worrying about north and south today now this might shock you i went up to a taxi and said eight rue du bois and here i am,3
you remember this room,3
foolish if this dress were to walk down the boulevard all by itself i would follow it from one end of paris to the other and when i caught up with it i would say just a moment you charming little dress i want you to meet ninotchka you two were meant for each other ninotchka feels more comfortable,3
i dont look too foolish,3
well so far it isnt funny but wait he says to the waiter waiter bring me a cup of coffee so the waiter comes back five minutes later and says im sorry sir we have no coffee wait a minute wait a minute im all mixed up a man comes in a restaurant he sits down he calls the waiter and he says waiter get me a cup of coffee without cream and five minutes later the waiter comes back and says im sorry sir we have no cream can it be a glass of milk,3
yes,3
he sits down at the table and says to the waiter did you get that too,3
yes,3
ill tell you that joke again a man comes into a restaurant did you get that,3
so you dont think thats funny it is funny everyone else thinks so maybe you didnt get it,3
no,3
not funny huh,3
maybe you havent any sense of humor well ill give you one more chance now listen,3
i dont think so,3
it seemed funny to me when i first heard it maybe the trouble isnt with the joke maybe its with you,3
no,3
i suppose you dont think thats funny,3
so do i now heres a great one ha ha ha well maybe its not so good lets forget it hows this two men are looking at the moon one says to the other is it true that a lot of people live on the moon yes it is says the other five hundred million whew replies the first they must get pretty crowded when its half moon ha ha ha,3
i wish they had never met,3
two scotchmen met on the street and i dont know the name of the street and it really doesnt matter well anyway ones name was mcintosh and the others was mcgillicuddy mcintosh says to mcgillicuddy hello mr mcgillicuddy and mcgillicuddy says to mcintosh hello mr mcintosh and then mcintosh says to mcgillicuddy how is mrs mcgillicuddy and then mcgillicuddy says to mcintosh how is mrs mcintosh,3
i have never heard one,3
do you like scotch stories,3
probably not,3
well er lets drop it i dont think you would care for that one,3
on which boat,3
thats not a laugh i mean a laugh from the heart now lets see im going to tell you a funny story just a moment ive got it well it seems there were a couple of frenchmen who went to america,3
ha ha now go back,3
no i cant leave you i wont not yet not until ive made you laugh at least once,3
then you should go back to your table,3
because we are an odd couple,3
why,3
at anything at the whole ludicrous spectacle of life at people being pompous and taking themselves seriously and exaggerating their own importance if you cant find anything else to laugh at you can laugh at you and me,3
at what,3
just smile,3
why,3
will you smile,3
what,3
death death always so glum what about life ninotchka do russians never think of life of the moment in which we are living the only moment we really have dont take it all so seriously ninotchka nothing is worth it please relax i beg you sergeant smile,3
but you have now and i know now that you are a man who employs business methods which in russia would be punished by death,3
oh ninotchka who wants to talk business if you win the suit fine if we win the suit better you do me an injustice when we went to my apartment did i have the slightest idea that you had any connection with this deal,3
your tactics are useless my name is neither buljanoff iranoff nor kopalski,3
must one always be after something,3
what are you after,3
just an old man his memory is getting weak,3
