bullshit i aint moving till i get something to eat youve been treating me like shit ever since i came out here if you dont like it you can take me back to the penitentiary and kiss my hungry black ass goodbye and i want some food some place nice some good people nice music,3
we eat when i say we eat,3
speakin of moans my stomach is startin to growl,3
yeah well my ass bleeds for you and i didnt get you out so you could go on a goddamn trim hunt stop moaning,3
do you know how close i was to getting some trim and you fucked it up,3
were on the move lets go as they walk toward a corridor,3
if you let him run around till tuesday hes gonna run right to ganz and warn him aint you motherfucker,3
hes gotta take that call if there is one,3
i think you better put him on ice man,3
what do you think,3
want to try it again,3
thank you,3
hey this works pretty good,3
just throw me the goddamn gun,3
i got a whole thing about people pointin guns at me,3
im tellin you to drop the goddam gun,3
quit playin cop and undo this cuff jack i need to talk to this man,3
im helpin you huh,3
luther aint the reliable type i dont want you shot yet cates not before you been a help to me,3
your pal nuts enough to take a shot at me,3
just up the street the other side over there now dont bother knockin on the door luther aint the kind of guy that looks for company,3
i may call you worse than that,3
then whatre you complainin about at least nobodys calling you shithead,3
i dont give a damn it happens to be my name,3
just an expression man dont mean nothin,3
i can read a police file shithead and quit calling me jack,3
what gang you talkin about jack,3
luther was part of the gang,3
dont worry i got a move for ya an awesome move a guy named luther ganzll be paying him a visit we go to him right away,3
okay lets get down to it i did my part and got you out so now you tell me where were goin,3
it looks like you bought it off one of the brothers,3
yeah,3
shit im already sorry,3
get this we aint partners we aint brothers we aint friends im puttin you down and keepin you down until ganz is locked up or dead and if ganz gets away youre gonna be sorry we ever met,3
no way to start a partnership,3
you just dont get it do your reggie there isnt any deal i own your ass,3
hey no way take off the bracelets or no deal,3
you got a girl shit the generosityof women never ceases to amaze me,3
i dont need to hear your jive i already got that department taken care of,3
listen it may be a little out of date you know i got a reputation for lookingreal sharp with the ladies,3
were supposed to be after a killer not a string of hookers,3
what are you talkin about this suits mine it cost 900,3
this prison gives out 400 suits,3
ill think about it,3
its the only way youre gonna get ganz,3
bullshit,3
i got a lot to protect,3
whats the big deal about you bein on the street,3
i can help you man but you gotta get me out i got to be on the street get me outta here,3
youre crazy,3
i can deliver ganz but you gotta get me outta here first,3
yeah,3
didnt work out that way he busted out with a big indian they capped two guards on a road gang nice meeting you reggie,3
ganz is in jail hes gonna be there two years after im on the street,3
yeah i noticed,3
not likely reggie maybe i just need some help,3
you here to write my life story,3
sure anything you want,3
try cates and lets talk in private okay,3
you got a name cop,3
im taking my prisoner back to jail,3
where the christ do you think youre going,3
just cause you say it with conviction dont mean shit to me how you gonna take to a pink slip huh,3
hes got more brains and more guts in one corner of his asshole than any cop ive worked with,3
too bad it wouldve covered your ass now youre in the shit and sos the department in case you havent noticed this wasnt our finest hour i told you everyone was watchin on this one maybe you better start thinkin about writin tickets off a three wheel bike,3
i didnt have the time,3
dont duck the bullet cates why didnt you call in for backup instead of makin a grandstand play,3
right i screwed up i fucked up i messed up anybody could have done better especially you i bet youre real good at hitting targets through crowds,3
what a screwup,3
you couldnt get to him,3
the indian i was about 30 yards away,3
which one pulled the trigger,3
they ran as fast as they could caught a train,3
how did they get away,3
i lost them thats what happened,3
what the bell happened,3
ill keep it in mind,3
try not to get your ass shot to pieces we got enough dead cops on this one,3
yeah,3
jack,3
you really know how to send a guy out with a great attitude he starts to go,3
okay youre not a team player you gotta do things your own way fine nail this guy and make us all look good but you better watch your ass if you screw up i can promise you youre goin down,3
being a hot dogs worked pretty well for me so far besides i got a lead,3
you might be more of a team player and a little less of a hot dog on this one jack,3
yeah it bothers me when cops get hurt while im makin a play i dont like it,3
anthing botherin you besides losin your gun,3
yeah,3
jack come on there is an official department policy about cop killings cop killers represent a special priority because any man crazy enough to kill a cop is a greater threat to an unarmed civilian in other words we cant seen like were in the revenge business i know we all know the truths a little different,3
hey the bastards got my gun i want it back,3
yeah i read the report,3
i want to be left alone on this one algren was killed with my gun,3
i guess when two cops die on account of your fuck up you want to keep it as quiet as possible,3
are you gonna tell me about police procedure do me a favor dont give me a bunch of crap,3
somebody steals your gun youre supposed to file a report,3
the truth hurts doesnt it buddy,3
but thats what you say about all of us all the tine were always the ones fucking up when you tell it,3
yeah,3
thats what you say cates,3
im not paid to take your personal calls he was in some bar off duty,3
jesus christ why the hell didnt you tell me before,3
what,3
i almost forgot that pal of yours from the vice squad wants you to call him,3
okay see you in the morning you know you ought to get some rest,3
i got to wait for a call,3
im heading out how about you,3
bullshit red tape,3
nothing,3
nothing came in for me yet no calls,3
doesnt look like it,3
aw bullshit you heard wrong,3
long night too from what i heard words going around that in addition to losing ganz for the second time and in addition to haden busting you back to patrolman some jig beat the crap out of you,3
so do youbeen a long day,3
you look awful,3
one of ems in the slam,3
heres the file cates checks the file,3
i think i wanna have a discussion about it with any of the ones still walking can we find them,3
hey dick tracy,3
tell me thats not the same guy,3
uhh wong henry wong he was in on the same job,3
wait a minute wait a minute whos this,3
they all pulled a bunch of jobs with ganz about four years ago,3
who are all these,3
backup man from the east bay worked with ganz a few years ago and sprung him from the road gang,3
billy bear,3
shit,3
this guy must have had a 44 like yours jack now hes got yours,3
ill help you out,3
every last bit of it the big guys room was empty,3
is that what this guy ganz had in the hotel,3
i dunno hes gonna call me,3
when how,3
he he wants me to help him skip town,3
i dont know,3
i think i met her now tell us something we dont know like where they stashed her,3
ganz and billy got my girl rosalie,3
who gives a fuck what you think,3
you just took a shot at me asshole i think you do know where he is,3
havent seen him for years thats the truth,3
i sure aint his fairy godmother now im looking for ganzwhere is he,3
a cop,3
thats what i always say,3
youre impossible,3
hes takin care of the same business ill be takin care of soon as i dry off,3
tell me,3
promised id turn my back while he ah never mind,3
where is he,3
three more hours,3
yeah bein a hardass all the time is a real drag but it works,3
ive been waiting a long time to hear you say that,3
usual bullshit you make one smart move and everybody wants to be your friend you know somethin shootin guys sucks especially compared to this,3
howd they take it back at headquarters,3
lets go reggie,3
what do i know im just a bartender,3
whaddya think,3
oh yeah well look where you came when you were down and out,3
hey come on shrink times over they wouldnt go see some old girlfriend,3
when a guy hurts you then comes back bleeding on his hands and knees who knows he might just be irrestible,3
so what,3
it might pay to reexamine a few of your more primitive notions i was in bed with a girlfriend watching tv last week jack and one thing we know about me is i happen not to be a lesbian now if this indians girlfriend got upset when you came looking for him it could just be shes still vulnerable to him,3
come on they were a little old for a slumber party,3
what makes you think they were lesbians or as you so quaintly put it dykes,3
jack its all over the papers hes an obvious type but this indian,3
how do you know,3
ganz is going to be hard to track just a pure schizo wires all crossed totally without any pattern kill anybody the indian himself anybody,3
nothing no sign of ganz no sign of the indian airports clean train station bus station docks shit,3
ive been betterdead end no ganz no indian,3
you real down,3
we and my pal here have been taking it on the chin for the last few hours,3
i can see that pardon me for saying so but you look like shit what happened,3
dont weve had a hard night,3
i ought to have you and your friend thrown out,3
hiya kid,3
hey i dont believe it,3
fuck you,3
hi its me,3
hello,3
just a second thats all,3
jack wait,3
elaine i gotta put you on hold,3
jack what was that,3
the number whats the goddamn number,3
so am i,3
no its im just surprised you called,3
no wonder youre so popular,3
elaine i im sorry i was expecting somebody else police business,3
im at work asshole where else,3
this is not the way people who care for each other are supposed to behave,3
listen goddamn it if you think im happy about it youre nuts i just gotta take care of a few things okay,3
elaine look im in the middle of sone stuff right now im not gonna have time to come by i dont know when i can get there,3
just one some lady called said shes a little hotheaded sometimes but she still wants her occasional roommate shed like to talk it over after she gets off work tonight if its humanly possible,3
i get that the job first everything else especially me second i get it i dont like it,3
thats right im not like you im not gonna sit on my ass wondering whats right and whats wrong theres a psycho out there killing people with my gun and im gonna get him because its my job and if you dont get that,3
here it comes again the sacred job,3
i didnt get burned two cops did listen ill tell you about personnel responsibility i like to get the job done right and if i dont get my job done right im for shit,3
look jack if you make everything your personal responsibility youll turn into a bad cop its not a practical way to function,3
bullshit ill tell you about bullshit my guns a real weapon in the hands of a real maniac who knows how to use it it isnt my macho bullshit thats killing people my gun is,3
look spare me the macho bullshit about your gun,3
sure okay fine no problem see theres this kid in jail first thing i got to do is go up and see what he knows,3
jack are you okay,3
yeah guess it must have been a slow news day,3
you made the front page,3
yeah one of my favorites,3
great place for lunch,3
guess people ought to know who i am,3
i think you forgot this hands him his wallet and badge,3
thanks for the coffee,3
yeah for some reason im sure,3
you sure you want me to,3
call me later,3
thats the way i see it too,3
you know something jack you really are hopeless,3
i wish youd stop trying to make me mad so i wont care for you i wish youd give me a little more of a chance,3
what do you want to know what difference does it make im the guy in your bed the last three months i make you feel good you make me feel good what the hell else do you want from a guy,3
when you start with that attitude its like i dont know who you are,3
maybe you dont know what the hell youre talking about,3
maybe that makes a nice excuse,3
maybe i got a fairly crummy day ahead,3
thats a fairly crummy way to start a morning,3
maybe i would if i knew when you were coming back,3
maybe you ought to buy me one,3
what makes you think i have any clean shirts at my place,3
you know if you let me come over to your place once in a while you could put on a clean shirt in the morning,3
i think youre ashamed to tend bar which is sad because you look great in that outfit they make you wear you pull down four bills a week which is damn good and you mix the best pina coladas ive ever had i think that if you need bigger and better things then go for em,3
tell meim dyin to hear it,3
hey you know what i really think,3
if this is your idea of sympathetic interest in my problems ill take brutal indifference,3
i do think all psychotherapy is bullshit but just because i think its bullshit doesnt mean i dont know something about it,3
arent you the one that thinks all psychotherapy is bullshit,3
positive selfimage problem all over again you are who you decide you are unless youre the type that lets assholes decide for you,3
then i sit back and i think i mean whos to say im not a dumb bitch i work in a bar right i cant read a list of my academic credentials to every boozehound that comes in the place you are what you do,3
i guess he got the message,3
irrigated his face with the shot of j and b id just poured him then i tried to deck the sucker,3
whatd you do,3
a guy in the bar called me a dumb bitch today,3
whats wrong with that,3
im all wet,3
thats the way i see it too,3
youre hopeless,3
hey youre right,3
i still dont think its loaded,3
this is a 44 magnum the most powerful handgun in the world you gotta ask yourself just one question are you feelin lucky,3
i dont think your guns loaded,3
i dont answer questions i ask em,3
what am i wanted for,3
in all due respect he sounds kind of pathetic to me the kind of guy that runs home to his momma or some girlfriend have you two ace detectives checked that out,3
he was the only one of my bunch that was my friend he was loyal went all the way for you,3
thats no bull,3
hey two days with him is enough,3
how would you know,3
hard man to live with,3
shrink major not a shrink,3
well i been workin the other side of the street for the last few years and you dont exactly look like a shrink wearin that dress,3
im not so sure i can say the same thingyou dont look like a cop,3
names hammond reggie hammond i heard a lot about you and any friend of jacks is a friend of mine,3
who the hell are you,3
alright im cominghold on,3
keep stallin,3
what do you want,3
stall,3
shut up,3
what do you want whats goin on,3
what the hells wrong i didnt do anything,3
shut up,3
hey,3
sure right,3
well follow you take it slowokay,3
yeah old times,3
we got a lot to talk about,3
cant complain,3
how ya doin,3
hot hey theyre not even room temperature,3
how hot are they,3
what are you talkin about i said i wouldnt hurt her,3
rosalie you okay,3
first the money,3
let her go,3
you try to mess with us or go to the cops i promise you ill put holes in her you wouldnt believe,3
come on you can trust me please,3
honest the place we stashed it opens monday morning i cant get it till then monday morning thats when it opens after that ill get the money to you right away,3
you chickenshit punk,3
i cant get it until monday honest,3
when,3
no dont kill her i can get you the money,3
billy go ahead break it,3
dont give me this we were partners,3
instead of worryin about reggie you better worry about me,3
you want that indian to snap her neck,3
i dont know what youre talkin about,3
i want the money asshole what do you think the money that reggie hid,3
whaddya want i thought you were locked up,3
surprise luther,3
ill got your money to you no sweat,3
fuck you you got no right for this kind of play,3
try and take it,3
give it back,3
yeah i know that but this is me and were old friends i havent got the money so what are you gonna do about it,3
this aint a credit business,3
five on credit,3
five bills,3
dont mess with me how much,3
this is clean shit no serial numbers and never been used,3
how much,3
its loaded i got some shells in here,3
how about some ammo,3
you sure,3
naw right heres okay,3
you want to go outside,3
not bad not bad,3
how you doing man,3
i cant pretend to be your husband davids in great shape,3
akta dedero ansila do mektet,3
no im not proud of myself but we dont have the luxury of choice,3
vano da mechteba soun domo kala chon hammas,3
you know exactly where they are,3
iksetkiba me imanetaba oum dalat,3
the case was stolen,3
san agamat chay bet envolet,3
the casewith the stones where is it,3
napoleon small,3
whatre you laughing about,3
at your service,3
cornilius,3
appipulai leeloo minai,3
i know,3
you are a monster zorg,3
let me reassure you fatheri will never kill more people in my entire life than religion has killed in the last 2000 years,3
destroying a glass is one thingkilling people with the weapons you produce is quite another,3
father by creating a little destruction i am in fact encouraging life so in reality you and i are in the same business,3
they are robots,3
look at all these little things so busy all of a sudden notice how each one is useful what a lovely ballet so full of form and color so full oflife,3
follow me life which you so nobly serve comes from destruction look at this empty glass,3
no thank you,3
would you like a drink,3
ah father you are so wrong let me explain,3
im a priest im here to serve life all you want to do is destroy it,3
why whats wrong with me,3
even it i did know where the stones were i would never tell somebody like you,3
personally they are of no interest to me id rather sell weaponsbut i have a customer so tell me,3
why on earth do the stones interest you,3
im glad you got your memory back father because youre going to need it where are the stones,3
i remember you nowthe so called art dealer,3
zorg jeanbaptiste emmanuel zorg nice to see you again,3
im fucked,3
were saved,3
thats what im saying,3
and you dont know how they open is that what you are saying,3
yes of course but the stones are shut they have to be open for it to work,3
theres no light you told me there were supposed to be four beams of light,3
theoretically yes the four stones form the beam and the fifth element is supposed to stand in the middle there but i dont have the reference book ive never seen the stones work,3
dont tell me you dont know how all this works,3
uh have you tried the divas suite,3
when is she not in trouble,3
leeloos in trouble,3
yeah i know to save the world but right now all i want to do is save leeloo,3
youre probably very angry with me and i quite understand but i want you to know im fighting for a noble cause,3
trying to save your ass so you can save the world,3
what are you doing,3
father i was in the army for awhile and every time they told us we were on a mission to save the world the only thing that changed was i lost a lot of friends so thanks for the offer but no thanks,3
of course,3
good luck,3
we have to save the world,3
what kind of mission,3
were not going on vacationwere on a mission,3
is that the usual way priests go on vacation,3
im sorry to have to resort to such methods but we heard about your good luck on he radio and we need the tickets to fhloston,3
thats what i thought,3
it means never without my permission,3
excuse me just one thing she said something to me a while ago and i dont really get it akta gamat,3
i know i was there when she arrived,3
shes fine reallydont you worry just needs some restshes had a very long trip,3
i might call to check up on her you know to see if shes better,3
yes thats fine thank you very much a thousand times over,3
dallas korben dallas,3
thank you so much for your help mr,3
shes an exception,3
they all like this in your family father,3
uh yes were cousinsdistant cousins,3
so you do know her,3
theres not a moment to lose wake her up but be gentle about it this woman is mankinds most precious possession she is perfect,3
you noticed,3
hes a she,3
the girl,3
i brought the girl remember,3
who are you,3
she dropped in on me holding this,3
thats me but i dont know who she is where did you find her,3
shes not my bride shes my fare shes looking for this vito cornelius according to the phone guide he lives here,3
weddings are one floor down congratulations,3
excuse me im looking for a priest,3
this is government business now you ought to go home and get some rest father,3
what are we going to do,3
thank you mr president,3
did you see thatthingswallow our battleship like a gum drop you cant even tell me what it is i ask you for options you give me bullshit give them permission to enter our territories with my warmest regards,3
white turns to black light to dark life to death for all eternity,3
but what happens if instead of this ultimate warrior it is evil who stands here,3
yesthank god,3
is there anything that can stop it,3
and then it will be too late the goal of evil is to wipe out life all forms of life for all eternitylife upsets it,3
and then,3
we have fortyeight hours the time it needs to adapt itself to our living conditions,3
thats exactly what we are going to try and do protect the lives of some 200 billion of our fellow citizens general you may fire when ready,3
time is of no importance mr president only life is important,3
your theory is interesting father but i dont think we have time to go into it right now,3
one more reason to shoot first eh,3
imagine for a moment that this thing is not anything that can be identified because it prefers not to be because it is the antithesis of all we are because it is evil total evil,3
later david later theres not a minute to lose,3
youre all safe thanks be to god,3
its all my fault im the servant its my mission here,3
on the plane with mr dallas the real one,3
wheres leeloo,3
good work my son now all we need is a way to get there,3
i got it everything here we need to know about fhloston paradise hotel and a detailed blueprint of the entire hotel,3
perfect,3
they really made her,3
i didnt know your size,3
there was this guy with a limp who came a month agosaid he was an art dealer asking all these questions about the sacred stonesat the time i didnt think anything of it what was his name im so bad with names,3
yes of course,3
uh father i know shes been through a lot but the sacred stoneswe dont have much time,3
learning our history the last 5000 years that she missed shes been out of circulation a while you know,3
whats she doing,3
absolutely sure theres the triple suns on her gloves,3
father you sure shes the supreme being,3
the supreme being the fifth element is here in our parish its a miracle,3
father will you please explain whats going on,3
i cant wear these clothes this calls for dignity i have to dress the part,3
what is,3
its a miracle,3
they are with me,3
im sorry but the stones,3
i would like to have died in peace,3
listen the last time i admitted to a woman i loved her i never saw her again,3
i dont have time i need to know,3
i i dont know we hardly know each other it takes time,3
do you love her,3
ill help her i promise but i think you should tell me where the stones are,3
she was taught to love the life of others but not her own you have to teach her to love if you want her to truly live,3
so cornelius was telling the truth,3
yes and more than that you must give her the stones shes the only one who knows how to use them,3
leeloo is shes,3
the fifth element the supreme being your wife,3
who,3
youre a good man she was right to have chosen you,3
leeloo,3
uh huhand i dont suppose you got the name of thisperfect fare,3
57 green eyes long legs great skin perfect,3
so just how big was this fare,3
fingermanim sorrylisteni was on the way over but i had a fare fall into my lap yknow one of those big fares you just cant resist,3
hey budim waiting all day here,3
hello,3
in your dreams see you tonight,3
uh at least fifty,3
how many points you got left on your license,3
finger im driving a cab now not a space fighter,3
you forgetting who sat next to you for a thousand missions i know how you drive,3
i dont need one,3
like shit,3
how do i look,3
i just found a picture of you,3
dont exist bud,3
i dont want a million i just want one a perfect one,3
you still pining for that two timing bitch forget her there are a million women out there,3
at least the cat comes back,3
oh yeah i forgotyou still prefer your cat to the real thing,3
i was talking to the cat,3
i love you too major but you havent called me that since basic training,3
hey bud finger here,3
yeah,3
leeloo,3
hey thats cute do you have a nickname something a little shorter,3
leeloo minai lekararibalaminaitchai ekbat de sebat,3
whats your name,3
im sorry its just that i was told to wake you up gently so i figured,3
eto akta gamat,3
vito cornelius,3
vito cor nilious priest,3
youre not that bad come on well get you to a doctor,3
priest,3
it theres one thing i dont need advice on its how to drive,3
daya deo dono dato dalutan,3
scuse me,3
akina delutan noushan,3
we will be ready lord,3
when evil returns so shall we,3
time is of no importance only life is important,3
