if they get set up in time which i doubt and even if they do theyll be looking for a buncha little latin fellas not a big black guy driving a ford,3
you wouldnt have time anyway we come to a roadblock theyll run the car find out in five seconds who it belongs to,3
guys like me huh well listen even though ive been celibate lately im not gonna force myself on you ive never done that in my life,3
the idea of going after guys like you appealed to me,3
yeah went real nice with that twelve gauge too tell me why in the world would someone like you ever become a federal marshall,3
i believe it youve ruined a nine hundreddollar suit my dad gave me,3
boy it stunk in there,3
in my bag in the car,3
wheres your gun your pistol,3
you devil its mace huh whatve you got here a billy use it on poor unfortunate offenders,3
for your breath you could use it squirt some in your mouth,3
there isnt any all this shit you got in here what is all this stuff anyway handcuffs chains whats this can,3
if i could have a little more room,3
you comfy,3
im a federal marshal and youre under arrest both of you guys,3
why youre just a girl what do you do for a living you pack a shotgun,3
why just because you left us standing on the side of the road,3
i thought you guys were busted,3
these guys man theyre crazy shit,3
whose blood you got all over you,3
i dont know,3
what happened to your shades someone finally step on em,3
yeah she said that to you,3
that broad you picked up did you know she was a us marshal for christ sake,3
werent you expecting us,3
the backseat,3
in the trunk,3
id like you to go wait in the car hows that take her with you and put her in back,3
youre in civilization now man ease up,3
wait in the car,3
you dont take em off im gonna throw em off the overpass while theyre still on your head,3
i see better with them on,3
take your sunglasses off,3
oh nuthin,3
studs man i havent heard that since lompoc whats going on,3
oh hey studs we thought you were somebody else,3
use your head the guys got five million lying around his house you really think hes gonna tell some motormouth he just met in prison about it,3
you think hes lying,3
my point is thats probably what youre gonna end up with,3
so whats your point,3
ever seen an uncut diamond studs they look like plain old rocks,3
detroit snoopy miller told me uncut diamonds are as easy to move as cash,3
i guess the bright glare out here made it hard to see the numbers on the weights,3
you guys come on this is too heavy,3
who you talkin to studs me or buddy i cant tell you got those shades on,3
he got three years and fined fifty million dollars and wrote em a fucking check like that fifty mil signed his name whoa little help here,3
i do but i wont tell you just yet meet me in the chapel at eightthirty right before lockdown,3
you know who they are,3
looks like tonight,3
when,3
i hear six,3
okay how many going out,3
i expect you to look out for me pup let me run off work details,3
how many,3
some people are going out of here what if i told you where and when,3
if thats my fate so be it im not leaving i love her jack,3
dont be an asshole richard theyre gonna kill you,3
im not leaving midge,3
i were you id get up and run,3
five point two,3
dumbfuck glenn was right theres about five million worth in there wouldnt you say richard,3
im not angry richard in fact im completely relaxed thing is i cant tell if its the fish thatre cooling me out or all those uncut diamonds on the bottom of the tank there,3
i cant believe youre still angry with me jack after all this time,3
good god theyre shooting midge,3
well go to my bank ill make a withdrawal,3
you gonna write me a check,3
what do you want from me jack name it you want money,3
a minute or two youre gonna wish you were,3
we thought it might be her husband sometimes he comes and checks up on her she told him i was down in florida,3
what kinda man lets a woman answer the door this time a night,3
have they got midge up there,3
maurice from lompoc good god,3
maurice miller couple of his friends,3
jesus christ what the hell are you doing here whats going on whos upstairs,3
how are you richard,3
foley that you,3
oh yeah im calm in fact im totally relaxed,3
gentlemen i think weve calmed down now havent we jack,3
jack im disappointed i guess i misjudged you,3
today im offering you a lousy job at a lousy wage you think youre better than that fine show me show me that youre really willing to change and well talk about something better a lot better but first jack you gotta earn it,3
first im goin to israel for a year study the talmud work on a kibbutz then come back maybe take some tennis lessons,3
you goin right back to work,3
whats to think about,3
i still havent made up my mind yet,3
the next time i walk into a bank,3
it works you should try it sometime,3
and the guy sent you a bill for this,3
the fish saved my life two years ago i found out i had high blood pressure so my doctor he tells me to go get an aquarium look at the fish every time i felt myself stressing out,3
i cant say that ive paid that much attention to em before,3
yeah fish live in the present they dont dwell on yesterday and they dont worry about tomorrow even when a big fish attacks a little fish theres no neurosis involved no guilt afterward no whining on some fishshrinks couch they just do it they accept,3
the fish,3
no need to decide now be like the fish let whatever happens happen,3
my exwifes in miami its nice down there,3
who is but then you gotta look at a job as more than just work you gotta look at it as peace of mind as isecurityi you know what i mean i got offices in detroit miami boston take your pick,3
i dont know im not exactly the ninetofive type,3
hey jack bullshit i didnt make my first million until i was forty two fortytwo you really uwantu to change its never too late,3
its a little late for me,3
i was just thinking that i could use a guy like you someone knows how to ask for things the right way im talkin about when youre outta here i mean you cant rob banks for ever,3
twentytwo months three days two hours why,3
tell me something jack how much longer you in here,3
its a big house,3
doesnt have to figure out shit you utoldu him you keep em at your house,3
plus even it was true hed still have to figure out where i keep em,3
of course not,3
yeah but whos gonna believe glenn i mean do uyouu believe glenn,3
youre the one with balls dick say something like that to someone like glenn or maybe you just forgot where you were for a minute,3
i know what youre talking about,3
no where do you keep it dick im talking about all those uncut diamonds you told glenn about,3
youre the reason jack i dont keep all my money in banks,3
youd be surprised what all you can get you ask for it the right way,3
really,3
i dont know i never used a gun,3
tell me something whats it like walk in a bank with a gun stick it up,3
any time,3
thanks for your help,3
first of all if he kills you hes not gonna get any more money out of you,3
really well i uhhh,3
youre smart ripley youll tell this guy to fuck off,3
must be a real soft pillow,3
sounds high doesnt it,3
oh uh right thanks,3
you dont wanna be standing there the hacks start asking questions you dont wanna answer,3
i dont know its a long way down to florida,3
like what,3
yeah could be or maybe she thought wed have a lot to talk about,3
cheaper i guess take us both down in one van,3
she did huh,3
apparently yeah i was supposed to leave last night with the lady marshal but for some reason she wanted to wait,3
and so now youre off to glades,3
hejira,3
you must be some kinda walker henry,3
ten you count the prison hospital in ohio i walked away from,3
the uninthu,3
yeah that was the ninth,3
there were others,3
that time,3
and how long was it before they caught up with you,3
i prefer to call it an exodus from an undesirable place,3
you busted out,3
meaning time came i left,3
meaning,3
for a time,3
you were at leavenworth huh,3
the brothers in leavenworth gave me the name,3
the flight,3
the hejira was the flight of mohammed from mecca in 622,3
whats it mean no hair,3
islamic,3
ihejirai what kinda name is that,3
if i didnt know you glenn by tomorrow youd be in jail or dead look at it that way go on,3
i know youll find me jesus i believe it i keep thinking if you hadnt driven me to federal court last summer you wouldnt even know who i am,3
but listen glenn if youre lying to me,3
really,3
you want to get out of here run itll warm you up,3
im freezing my ass off,3
gee i wonder why not,3
i dont know he doesnt exactly confide in me,3
but you say he hasnt shown up you think he backed out,3
maurice is gonna kill him try and collect the reward,3
whys that,3
hes supposed to be but he hasnt shown up yet which is a good thing for him,3
and is foley a part of this,3
yeah the plan was to pick him up at his office tomorrow take him out to his house in bloomfield hills now i dont give a shit what they do,3
ripley you mean the wall street guy,3
rippin off ripley was my idea but these guys man theyre into shit i cant handle,3
but i thought the whole thing was your idea,3
nothing i just wanna get the fuck outta here,3
whats going on glenn,3
listen these guys theyre gonna be out here any minute looking for me theyre fucking animals,3
for the car for aiding and abetting a prison escape and conspiring to do whatever you came here for,3
youre gonna bust me for picking up a car,3
glenn i know your life history who your friends are where youve been and now it looks like where youre going put your hands on the wheel,3
jesus howd you know about snoopy,3
the two guys you were with that one that isnt maurice miller is it ive seen snoopys mug shot and that didnt look like him,3
i already stole it last week or whenever it was in west palm i cant be stealing it again can i,3
youre not,3
i mean im not stealing the fucking car,3
another one of those days huh nothing seems to go right,3
jesus i dont believe it,3
glenn are you trying to steal this car,3
no way man no fuckin way am i gonna turn myself in,3
glenn take the exit,3
what am i supposed to do unowu,3
take the next exit,3
wait ihavei you helped him glenn at this point technically i doubt you could be charged with aiding a fugitive so you still have a choice you can help him and risk going down again get cuffed and shackled hope to god you pull a reasonable judge not some hardon or if you want to play it another way,3
were not im helping him yeah,3
look i can understand if you and foley are close,3
foleys not going to make it and if he goes down glenn you go with him,3
i remember you now shit,3
do we have a gun in the car,3
last fall i drove you from the palm beach county jail to the federal courthouse twice youre glenn michaels i never forget anyone ive cuffed and shackled,3
but youre sure weve met huh,3
no thats not what im thinking,3
it couldnt have been out at glades if thats what youre thinking i was never out there,3
you dont remember me do you,3
glenn,3
i got a big score lined up up north they wouldnt even know about it it wasnt for me i could do it right now myself except its so fucking cold up there in january,3
jesus whatd you crawl through a sewer,3
ill send it to you at glades,3
why would i do that,3
no you gonna stay close to me from now on so you dont disappear on me,3
its all right with you ill just hang in the car,3
yeah kenneth why you have to do that to that poor girl,3
whyd he have to do that to that girl,3
that was some shit huh,3
hey shit come on i say i want this car man its mine you go get yourself another one i say im in on ripley im in with or without iyouri ass i say i want you to come along on another job see if you for real or not guess what you gonna do,3
i think youre forgetting this is my car i drove it up here,3
look glenn i know you cool but you dont have to give me no tone of voice okay you dont like what im saying you can get out anywhere along here you want,3
i dont have to prove shit to you the ripley job is imyi job youre either in or youre not you wanna pop some crack dealer pissed you off thats your problem not mine,3
right now son,3
what when,3
walk in a house with me do this cross dressin nigga named eddie solomon i used to sell to been dealin on his own,3
can i do what,3
yeah if you can step up and actually do it understand stead of just talking the talk,3
me,3
thing im worried about is you,3
you just ask me how we gonna do it thats what im here for tell you how we the experts,3
wait a minute im letting iyoui in on this not all your friends,3
what,3
ill show you soon as i get one more guy im gonna need moselles brother kenneth along with white boy there,3
so you still havent said how you wanna do it,3
if theyre not busted now theyre gonna be its wide open,3
you sure foley and his pal arent coming up here do this themself,3
its lilac man the color and the styles made known by deion and other defensive backs in the pros i could be one of them living out here with doctors of my race and basketball players okay here comes mr ripleys house up on the left yeah the brick wall theres his drive right there,3
sure right they see bigfoot driving around a black guy wearing shades and a lavender fucking bandanna no they wont think anything of it,3
watch the road boy i like this town car we can cruise the mans neighbourhood without getting the police or private security people on our ass,3
oh im here all right im very here question is why arent uyouu here,3
you there,3
its richard ripley,3
gimme another hint,3
its a guy you know,3
someuoneu gimme a hint,3
i cant really go into it right now ill just tell you its someone big,3
uhhuh,3
i wanna talk to you about a job,3
you crazy come up uhereu its fuckin one degree outside,3
listen snoopy im on my way up to detroit and need a place to crash,3
studs hey son you must be one a them psychic friends i was just thinkin about you,3
snoopy glenn michaels,3
we went out there full swat two choppers the whole bit but linares started shooting anyway we put him down but somehow chirino got away,3
oh,3
foley oh no it was one of the cubans linares,3
great we got one of em,3
hows it going,3
he took the week off so wed have time together so far hes worked on his boat every day dad ray nicolet,3
you look great your dad taking good care of you,3
hi ray,3
you wanted to tussle we tussled,3
whats wrong with you,3
just a minute,3
dont matter i let the monster out you gonna do what it wants,3
youre not my type,3
you know your divisions you like the fights like the rough stuff yeah i bet you do like to get down and tussle a little bit like me and tuffy before she got run over we use to get down on the floor and tussle i say to her you a good dog tuffy heres a treat for you and i give tuffy what every dog love best you know what that is a bone i can give you a bone too girl,3
flyweight,3
light to supermiddleweight as my body developed you go about what bantam,3
whatd you fight middleweight,3
i iwasi,3
i can tell,3
how you know that,3
youre a fighter,3
the state theater,3
i dont know the gym the fights i iknowi he dont miss the fights having some tomorrow night at the state theater he use to take me,3
where do you think i might find maurice,3
was a she name tuffy,3
what did you call it,3
got run over by a car,3
your dog was killed,3
well ihei aint even here that much i like to know where he goes but at the same time i dont iwanti to know you understand,3
he said he stayed with maurice,3
here in this house,3
he said he stayed here last november,3
glenn no i dont know any glenn,3
no im not maybe you know him glenn michaels,3
you a lawyer,3
no,3
you not with probation one of those,3
im looking for a friend of mine i think maurice knows,3
thanks,3
you like to sit down,3
thats kenneth my brother hes talking on the phone,3
thats not maurice,3
you find him tell him the dog got run over and im out of grocery money,3
im looking for maurice,3
what do you want,3
moselle miller,3
my little girl the tough babe,3
he knew what he was doing nobody forced him to rob banks,3
i was just thinking you could have a nice time with him on the plane like picking up where your interlude or whatever you call it left off and then throw him in the can,3
its possible why,3
you gonna go get him,3
none id like to share,3
he doesnt seem to hold a grudge what iii want to know is why they got such a big score up north did foley hang around miami for so long any thoughts on that one,3
so what i want to know is why buddy still calls his sister every week even after she turned him in,3
so,3
buddys sister regina mary bragg got two calls from buddy up in detroit this morning called burdon shes also the one gave burdon buddys address,3
i imagine you wouldve though,3
i didnt have time,3
you wave back,3
i couldnt swear to it but im pretty sure he did,3
he waved to you,3
yeah but you talked all the way from gci to the turnpike it sounds more like a first date than a kidnapping,3
foley ikidinapped me,3
you like the wild ones dont you tillman nicolet and now foley you know ive always said theres a thin line between the cowboy cops and the armed robbers all those guys that love to pack,3
my married boyfriend setting him up with that news story so you could talk about infidelity i couldnt believe it,3
maybe but youre also curious about the man twice last night you asked your married boyfriend nicolet about him you were concerned but you didnt want to show it,3
i want to bust his ass put him in shackles,3
but you know hes dirty and you still wanna see him again,3
not at all,3
he remind you of that guy tillman,3
hes pretty laid back confident,3
remember pay attention to how she talks about foley her tone do it right shell tell you things she wouldnt tell burdon tell her you think hes a nice guy no first tell her about being in the trunk with him in the dark for half an hour and see how she takes it if shes in on it what does she get for all the aggravation cops breathing on her i bet nothing so she still likes him enough to stick her neck out you think thats possible what kind of guy is he,3
hello,3
hello yeah she is just a minute for you,3
off a tip,3
was it foley,3
i see that,3
rays with the fbi task force working on the prison break,3
no he looks a lot,3
no,3
he doesnt even look like that,3
tell you what youre a good girl you might get another one for christmas,3
the sig sauer you got me for my birthday,3
what are you thinking about,3
huh,3
hey yourself,3
whatd i say,3
you were talking in your sleep,3
id like that,3
how bout i come next sunday and watch the super bowl with you,3
we dont get to talk much any more,3
i really gotta go,3
youd meet doctors lawyers nothing wrong with them necessarily if theyre divorced why settle for some cowboy cop who drinks too much and cheats on his wife thats the way those hotshots are all of em,3
dad,3
you used to like it,3
no thanks,3
you know you can always step in work with me fulltime as one of my investigators,3
serving process a summons and complaint some con doing mandatory life doesnt like macaroni and cheese he files suit says he has no choice in what they serve and it violates his civil rights,3
whatre you doing at glades,3
can we change the subject,3
then theyre not separated are they,3
hes about to,3
oh hes moved out,3
technically theyre separated,3
hes still married though huh,3
he was rays with the fbi now he switched over,3
which one is that the atf guy,3
cant i gotta drive out to glades then im meeting ray nicolet at ten,3
happy birthday kid you want another coke,3
thanks dad,3
sigsauer 38 i love it,3
its a,3
its beautiful,3
something better open it,3
you fit another chanel suit in here,3
the combination is threetenfortyfour,3
aight this time we gotta get the motherfuckin trajectory right okay on three one two,3
like a fag,3
how do i look mama,3
lets go upstairs have a look at the mans bedroom all right now you and mr buddy check the rooms down here look at the wall behind any pictures hanging on it look at the walls in the closets the man has a safe its gonna be up there somewhere,3
i dont have any idea,3
wheres ripleys safe at he keep his valuables in,3
thats right just me,3
you here all by yourself,3
whens he due back,3
hes in florida palm beach,3
out for the evening,3
i told you he isnt here,3
not yet wheres mr ripley,3
so the womans married she goes to bed with this prison escapee because he misses his little girl and then tells the world about it but you dont reveal her name you protect her it sounds like youre saying its okay as long as her husband doesnt find out about it like the guy who cheats on his wife saying what she doesnt know wont hurt her,3
the woman also said he stole her husbands gun a twentytwo pistol and some of his clothes,3
thats how you score now,3
i spoke to her the guy told her he missed his little girl and she felt sorry for him,3
she fixes him pork chops and rice the next thing you know theyre making love on the sofa she says he was very gentle,3
yeah as soon as we got back,3
did you pay the guy the reward,3
i knew it soon as i saw they were offering a reward,3
yeah someone spotted two of em in this hobo camp out by the airport called the number,3
no course not,3
in case no one knows what he does tell me ray you ever wear one says undercover,3
likewise,3
ive heard a lot about you mr sisco,3
where the fuck is foley,3
foleys got it,3
forget about her tell me where the moneys at,3
midge,3
where you been hiding dick,3
are those imyi suits,3
well if it isnt the ripper hisself,3
yeah sure its all settled,3
excuse me snoopy did we settle the fish thing,3
still,3
faux goose down,3
and that extra pillows gonna be an even three cs,3
well i need that,3
that bausch lomb saline shit you asked for is gonna be eighty bucks,3
whoever the point is prices are goin up too better get your little black book out richard we got some business to talk about,3
i think its dunn ubradustreet but then i could be wrong,3
what,3
not so fast dick starting now theres gonna be an across the board cost a living increase,3
thank you,3
are they dead,3
the fuck is this,3
i found a rubber,3
i sent these two looking for him they come back shaking their heads,3
i think he mustve fell in,3
uhhuh you recall did it say dead or alive,3
ten gees,3
white boy how much is the reward on the man again,3
jack foley famous bank robber,3
we have a problem here,3
hes been like that all day hey danny you coming,3
what is it with red ive never seen him this way,3
if evelyns here the rest are here,3
are you sure theyre here,3
no numbnuts die you get your nurse alone you look her in the eye and say baby theyre training me for war and i dont know whatll happen but if i die tomorrow i wanna know that we lived all we could tonight ive never known it to fail,3
what goodlookin sumbitch,3
thats your line for tonight ya know,3
you goodlookin sumbitchdont you ever die,3
you dont forget love honey not ever,3
i wish she could forget him,3
no i was,3
he was that good,3
now listen its hands off billy i mean you can put your hands on him if you want to but then my hands will break yours,3
ooo shes thinking of her date come on youve been dating a pilot we want to know what we can expect,3
well ask evelyn evelyn evelyn,3
hide them on a date with pilots im talking about how you make them show,3
you mean hiding them,3
yeah but if i have to get something out i ccan always sss siiing,3
nervous,3
only when im nnn,3
do you always stutter,3
how would i know,3
butthey called you strange because of red grange i dont get it was red grange strange,3
you know the football player red g grange well the guys called me rred cause you know im redand they thought i was strange so you know red ggrange red strstrange,3
redstrange,3
he im rred red sstrange,3
not anxious to die sir anxious to matter,3
are all the yanks as anxious as you are to get yourself killed lieutenant,3
if youre patching up bullet holes right here on the runway maybe we should skip the housekeeping and get right to the planes,3
good on you then rafe mccawley well get you situated in some quarters and then introduce you to the equipment youll be flying,3
thats me sir,3
on loan from colonel doolittle is it,3
i wasnt gonna apologize sir i was just gonna say it was worth it to feel like a real pilot again even if it was only for five seconds,3
too late for apologies walker,3
sir i,3
youll love it no base no bars just lots of sun and aircraft maintenance,3
halewhat,3
i dont buy that hot dog shit so you and your buddies are gonna transfer your planes up to haleiwa,3
sir,3
oh yeah i liked it so much im cutting you out of the squadron,3
you liked that,3
that was a nice little stunt you pulled buzzing the base,3
yes sir,3
youre walker right,3
you guys know her i gotta have an intro man id like to,3
rafes girl evelyn,3
maitais i got this to tell ya about maitais,3
yeah,3
what the hell happened to you guys,3
the one that slept in my mouth last night,3
what lizard,3
wheres that lizard,3
hey you mr coma,3
yeah but he was wearing shoes,3
well you ppuked on his feet,3
shit hes puking on my feet,3
you guys are new,3
i ththink im gonna like it here,3
no like,3
a mmissionary,3
ever hear of maitais comes in a bigpot likelike,3
he did,3
who the fuck taught you to fly,3
anthony red stay with the guns coma you cover the cannons joe theo come with us earl you get on the radio were gonna fight these fuckers,3
danny i dont like this fuckin guy,3
of the four left only one is full of fuel,3
earl you said the planes were ready but but what,3
you guys get those earl rafe come with me,3
