are you crazy take the boat,3
thats one way of putting it kitz the president the isc have shut down all official communications thereve also been reports of riots flaring up across the us and europe until we figure out what went wrong things may get rough especially for you,3
peter what is going on has everyone gone completely insane,3
how long was i gone,3
what day,3
peter what are you talking about what malfunction what day is this,3
its all right the important thing is youre safe,3
wait hold on a minute,3
thank god when we lost contact i thought we thought but youre okay were still trying to determine the nature of the malfunction did you notice anything at all that,3
im im fine,3
ellie are you okay,3
like it almost there,3
like it or not,3
that you valerian,3
its really happening,3
someone tell me this is really happening,3
you too,3
its good to see you ellie,3
peter,3
ellie,3
that is true but its also true that if i really thought we wanted the same things id follow you anywhere but the truth is i dont think you want the company be honest el theres nowhere youd rather be than sitting out at some remote corner of the world searching for the answers to the mysteries of the universe and call me crazy but i just cant compete with that im sorry,3
you sonofabitch,3
ellie im getting married her names laura she came up to owens valley to do her postdoc about six months after you left,3
im serious about this peter,3
ellie,3
right now well drive down to ramey and get the base chaplain to marry us,3
jesus,3
and you think i dont want those things you think i dont stay up half the night wondering if ive made the right choice living half a world away from you wondering if any of this is worth what im giving up for it everyday lets get married,3
maybe thats the problem i want a family ellie i want kids a townhouse on l street instead of still living like a college kid a real life maybe that makes me a sellout but i dont care anymore its what i want,3
please youre just as ambitious as i am more,3
the work jesus ellie cant there just once be more to life than the work okay maybe thats the only way to get the recognition win the prizes,3
but the work,3
this is a chance to be of enormous help to other peoples research to have the power to be a real advocate where davids got blind spots,3
but what about your research,3
im going on staff at the nsf to work for drumlin,3
greenbank,3
im moving to washington,3
we could be together again,3
actually,3
peter if you can get him to do that for me hed obviously do the same for you we could,3
thirtyone linked dishes you could search more sky there in a day than you could in a year here,3
the vla,3
what if i said i could get drumlin to agree to sell you time in new mexico,3
its almost there the hardest part is getting someone to sell us the telescope time,3
how close are you to getting this funding put together,3
if we lived at any previous time in human history we wouldnt even have the option of failing wed have to wonder our whole lives unable to do anything about it this time right now is unique in our history in any civilizations history the moment of the acquisition of technology the moment when contact becomes possible weve already beaten incredible odds by being lucky enough to be alive now,3
ellie even if you do manage to raise the money have you thought about what it would really mean to follow through on this i mean a college fetish is one thing but were talking about your career you wont be publishing you wont be taken seriously and you could spend your entire life looking and never find anything at all,3
weve been going after some of the big multinationals but without much luck got a donation from a new york dowager weve even been thinking about selling tshirts,3
ive examined over forty stars of roughly solar spectral type but so far nothing still weve barely started,3
and,3
please any chance of that died the day david drumlin was appointed head of the nsf i have been in contact with a few other seti people weve been trying to find backing from private investors ive even managed to scrounge a couple of hours of telescope time here and there,3
any luck on the grant money,3
i keep telling myself okay thats just the price you have to do your time doing shitwork before youre allowed to get to the good stuff but if i have to catalog one more quasar god ive missed you,3
is indistinguishable from magic,3
any sufficiently advanced technology,3
its like the precopernicans who swore the sun revolved around the earth or the victorians at the end of the last century who concluded that all major discoveries had now been made i mean try to imagine civilization a thousand years ahead of us then imagine trying to explain i dunno a microwave oven to someone even a hundred years ago i mean the basic concepts didnt exist,3
they cant i think its against human nature to admit to that level of insignificance to not see yourself as basically the center of the universe,3
im just so sick of feeling defensive about the things i care about or being lumped in with the lunatic fringe by people like drumlin when if theyd just put aside their preconceptions for two seconds and look at the facts,3
what a coincidence it happens to be my fetish too,3
keep it down okay drumlin thinks im enough of a flake as it is look everyone here has their little fetishes caven goes to topless bars vernons got his carnivorous plants mine just happens to be extraterrestrial intelligence,3
i read your paper on etis its brilliant,3
yavol,3
sounds like a russian general,3
peter valerian,3
ellie arroway,3
thats what they all say,3
hes an incredible prick but i never learned so much in my life,3
its beautiful but it does get a little lonely sometimes i think the reason we build these things in such godforsaken places isnt to avoid excess radio traffic but because were all such pathetic antisocial misfits speaking of which howre you getting on with the old man,3
drumlin said youre been down at arecibo for the last year,3
something my dad they said after all the suffering after all the desolation of the void the one thing that makes the vastness tolerable is each other the one thing that makes it bearable is love,3
meaning,3
im not sure maybe it simply exists in the search for it maybe its something we have to make for ourselves,3
does that mean you think it doesnt exist,3
i dont know if it was a god it was searching for a greater one it was still searching for meaning,3
in other words,3
in other words god works in mysterious ways,3
maybe what you experienced cant be reduced to images on a videotape maybe they still plan to grant your request only in their own way in their own time or maybe its just like you said ultimately their motives may be as incomprehensible as their technology,3
but it is a good question and i suppose ill always wonder about the answer why would they send me back without proof,3
ellie if you go out there like this if you admit to even the possibility that what you experienced didnt actually happen im afraid they really will crucify you please for your own sake for the sake of the world tell them what you know to be the truth tell them it really happened,3
i want to palmer more than anything but it has to be real it has to be true,3
have you seen whats happening out there the terror the despair the world is on fire ellie people need something they can believe in something worthy and you can give it to them,3
but,3
ellie the only one holding you to that standard is you the people want to hear your story they need to hear it,3
its not enough dont you understand i know it happened but by every standard of science by every standard ive lived my life by that fact is utterly beside the point it may be true but it doesnt matter because i cant prove its real,3
ellie youre the proof you tell them your story ultimately theyll have no choice but to believe you,3
i dont have any proof palmer,3
it also makes god enormous i think of the scope of your universe ellie and it takes my breath away as it will everyone elses,3
youre sure you want to in the universe i saw were not exactly the stars of the show what happened to me makes us all seem pretty damn small,3
i do,3
they dont believe me,3
im not sure its come to that,3
so im assuming they sent you here to administer last rites,3
pretty ironic huh i had to go all the way to the center of the galaxy just to find you,3
it was quite a page turner,3
im assuming you read my deposition,3
hi,3
hi,3
and yet thats always how i seem to end up isnt it if you really do love me palmer youll leave now please,3
ellie there is no reason you have to be alone,3
i cant hear this now,3
do you really think your life is meaningless eleanor is that why youre so quick to risk it because if your life means nothing then you have nothing to lose,3
i dont know,3
and then what then youll be safe,3
dont you understand i just have to hold it together just until tomorrow,3
im in love with you ellie,3
please,3
what are my other options in fifty years never,3
please palmer if you care for me at all dont push this now,3
what are you so afraid of,3
i cant do this,3
what,3
im sorry i cant,3
ellie what is it,3
what is it,3
im sorry,3
what,3
maybe thats okay,3
i do seem to be maybe because im just a little bit terrified about tomorrow,3
youre trembling,3
thank you,3
during the crusades pilgrims who made the journey to the holy land brought back a palm frond to show theyd actually been there i thought it sort of made sense that earth is now your holy land so,3
oh i brought you something,3
the final countdown,3
so the final countdown,3
i remember you were indelicate indiscreet and entirely less than tactful sound like anyone you know,3
ellie the last time we spoke i said some things,3
what if their answer is oh thats easy a thousand years ago our world was in terrible shape our population out of control violent crime no food so we called a general council and decided to eliminate the anitsocial the weak the sick the unwanted and ever since weve been doing great,3
how do you mean,3
an excellent question doctor but what if we dont like the answer,3
another question i would ask would be a very simple one how did you do it how did you evolve as far as you have and not destroy yourselves,3
its late we should go back,3
ellie,3
what are you so afraid of ellie,3
its getting late,3
and yet youre willing to die for this cause the one thing thats given your life a sense of purpose dont you see the contradiction here,3
relax its okay take a deep breath,3
oh i suck i suck,3
okay,3
well hurry up i want to be at mrs rosemonds before lunch,3
im in the bath mom,3
dont you raise your voice at me go to your room now,3
those are my letters,3
margarita found them while cleaning your room,3
where did you find those,3
cecile is that the best you can do you must forgive her kathryn shes never been in a coeducational atmosphere before,3
what are the boys like,3
cool,3
thats one way of looking at it,3
its like a secret society,3
cecile everybody does it its just that nobody talks about it,3
but that would make me a slut wouldnt it,3
so dont you want to make ronald a happy pappy practice makes perfect cecile my advice is to sleep with as many people as possible,3
i dont love him i love ronald,3
now listen now that youre on your way it would be stupid of you to stop think of sebastian as a tutor let him instruct you,3
i am,3
im so proud of you youre becoming a woman,3
i did,3
well i dont know it was weird at first it felt icky then it felt kind of okay then i started getting really hot and then i started shaking and then like i dont t know it felt like an explosion but a good one,3
well did you like it,3
what do i do then,3
cecile i think youre going to have a hard time crying rape if thats all he did,3
if thats what you call it,3
well what then,3
no,3
he made you give him a blow job,3
well not exactly,3
so let me get this straight you came over to our house late last night and he forced intercourse on you,3
i dont know,3
why didnt you do something,3
if she knew shed kill me it happened at your house last night,3
does your mother know,3
it involves your brother he took advantage of me,3
cecile you have to tell me,3
i i dont think you want to know,3
what do you mean,3
something awful happened last night,3
calm down tell me whats wrong,3
its kathryn,3
who is it,3
best friends,3
of course i would were friends right,3
youd do that for me,3
cecile if theres one thing im great at its love letters with my help hell be eating out of the palm of your hand perhaps we can arrange a little get together for the two of you at my house,3
why,3
i want you to make me copies of his letters and bring them to me,3
yes theyre in this antique doll house in my room,3
did you hide the letters,3
okay,3
listen to me your mother must never know never,3
i do like him i cant stop thinking about him,3
cecile we just made out in the middle of central park you can trust me,3
i dont know,3
well do you like him,3
no,3
thats so romantic have you responded,3
is it that obvious,3
oh come on cecile hes crazy about you,3
what are you saying,3
maybe you should try it on your friend ronald sometime,3
that was cool,3
eyes closed,3
okay,3
lets try it again only this time im going to stick my tongue in your mouth when i do that i want you to massage my tongue with yours thats what first base is,3
it was nothing,3
see that wasnt so bad,3
i guess it still sounds gross,3
do you want to learn or not,3
are you for real,3
its not gross how else do you think girls learn here turn around and face me,3
eww no thats gross,3
havent you ever practiced with one of your girlfriends,3
ah duh boys ive never even gone to first base with a guy what do i do,3
what are you scared of,3
you think so i dont know i guess im just scared,3
thats great,3
what a loser she must be anyhow courts invited me to the hamptons for labor day weekend,3
really bulimic headcase,3
hes alright he kept talking about this bulimic headcase he dumped over fourth of july,3
so rumor has it that you went on a date with court reynolds i hear hes very nice,3
thanks nice meeting you,3
ill call you later and well get together and plan your curriculum,3
i was thanking her vietnamese is such a beautiful language,3
what was that,3
prude,3
good night cecile,3
want a blow job,3
no,3
need any company,3
im taking a shower,3
where are you going,3
no you were fine,3
is it me,3
you think,3
im sorry,3
cecile this is what i like to call quiet time this is time when we reflect on what weve done,3
i like it better when im on top,3
for the first time yes itll pass,3
am i suppose to be this sore,3
some other time cecile,3
want to join me,3
i dont want to kiss you here i want to kiss you there,3
but,3
you promised to let me kiss you,3
what are you doing,3
i swear,3
just a kiss right,3
of course im not a monster,3
and then i can go home,3
cecile all i want to do is give you a kiss,3
please please please ill do anything just dont call my mom,3
why not oh wow she doesnt know youre here in fact youre grounded jesus you could get in a shitload of trouble for this i think i should call her anyway,3
my mom dont call my mom,3
okay okay ill just call your mom and have her come pick you up,3
i want to go home,3
i was just kidding,3
i want to go home,3
im sorry that was out of line,3
mmmm youre right those clothes dont do you justice why dont you take them off,3
i look terrible,3
just taking your photo,3
what are you doing,3
hell love it,3
you think hell like it,3
excellent,3
it is unless youre a fuck up like myself,3
but i thought high school is only four years,3
im what you would call a fifth year senior,3
what year are you in,3
how are things down under blossoming i hope,3
my father just took me on a trip to australia,3
would you please leave,3
what nervous im going to win,3
good luck sebastian,3
really care to make a wager on that,3
dont even think about it rachel is an exceptionally well rounded young woman who happens to be attending princeton this fall shes way too smart to fall for your line of bs,3
yummy,3
my daughter rachel,3
well you dont have to get nasty about it,3
i hope for your sake you grow out of this immature phase its going to get you into trouble,3
you do,3
no it doesnt i see right through you,3
it works a little,3
you think you can come in here with that cute little smirk on your face and try and flirt with me it doesnt work sebastian,3
dont be insecure doc youre a big help,3
this isnt a joke your parents spend a lot of money to send you here im trying to help you,3
why i like spending time with you you know youre quite attractive for a woman your age you have killer legs killer,3
no this is going to be our last session,3
same time next week,3
i think thats all the time we have for today,3
let me tell you something doctor chicks love a guy with a bad rap they say they dont but they dont mean it they all think that theyre the ones that are going to save me the trick is to let them think its true,3
dont you want to change that,3
i do,3
but you said you have the worst reputation,3
i know,3
and you havent made an ounce of progress,3
i know,3
jesus weve been at this for six months,3
i dont know he was just so charming all he did was talk about how i had killer legs and how we wanted to photograph them things just got out of hand from there mom are you there mom mother,3
jesus christ how can you be so stupid,3
nudie pictures what do you think,3
would you cut the psycho babble bullshit mom theres pictures of me on the internet,3
alright honey just calm down take a deep breath and step out of the circle,3
you dont know him im so stupid,3
who told you,3
he told me he loved me and i believed him,3
honey is something wrong,3
hi mom,3
grand central you better not be fucking with me cause its your ass on the line,3
alright shes staying with some friends of her parents the osheas she caught the train twenty minutes ago into grand central,3
one,3
i told you i dont know,3
mcconnell im gonna out your ass in two seconds if you dont tell me where she is,3
i dont know why dont you leave her alone,3
where is she,3
no,3
sebastian you faggot is she with you,3
who is this,3
is she with you,3
ill be in touch,3
she bought it,3
pretty sure or sure sure,3
im pretty sure she did,3
and you think she bought it,3
yes,3
you told her that people are jealous cause im loaded,3
yes,3
you told her i never said i love you before,3
yes,3
did you do everything i asked you to,3
positive,3
i swear on my life i never said a word to her about you,3
come on greg youre the only one who knows her the truth will save you,3
annette harrison i dont know what youre talking about,3
your career what about your family can you imagine the humiliation your fathers going to feel when he finds out his pride and joy is a fudge packer,3
please dont tell anyone this could ruin my career,3
really drunk and blah blah blah blah blah,3
i told you to lock the door,3
whoa,3
get out of here,3
greg is that you under the covers,3
jesus,3
hey blaine did i leave my holy shit,3
baby right on time,3
oh baby oh baby,3
dont worry about it ill stay,3
will you stay here for the night you can leave in the morning thats when my parents get back and,3
he doesnt scare me ill kick his ass in,3
id be careful if i were you god knows what hes up to,3
racist piece of shit,3
its been going on for a while then he called me a disgrace to our family and thats when he hit me,3
and this happened before you and i hooked up,3
and when i confronted him about his affair with cecile he told me it was none of my business then when i said well what about ronald he said you were nothing more than a stupid the n word and that you deserved what you got,3
ill be right there,3
i think hes high on drugs he hit me then took off im afraid to be alone please come over,3
what do you mean,3
its sebastian hes out of his mind,3
whats wrong,3
no,3
hi kathryn is everything okay,3
its kathryn,3
yeah,3
ronald,3
hello,3
but i cant even see her she doesnt have her own phone i dont even know her email address,3
what do you do tell her you love her,3
likewise im sure,3
pleased to meet you,3
war it is,3
i think you have your answer,3
then i will consider it a declaration of war one two three,3
and if i dont,3
im giving you to the count of three to plop your ass down on the bed,3
get out,3
i dont care what you said we had an agreement youve slept with half of the borough so dont tell me youre being choosy,3
didnt you hear what i said,3
get out we had an arrangement,3
i accept now get out,3
im very sorry about that i apologize,3
fine get off me,3
will you calm down,3
get off me,3
im sorry but unfortunately i dont fuck losers,3
in any event you still owe me my reward,3
you were very much in love with her and youre still in love with her but it amused me to make you ashamed of it you gave up on the first person you ever loved because i called you names dont get me wrong im flattered that you chose me over her but please understand i never loved you sebastian youre just a toy a little toy i play with and now youve completely blown it with her i think thats the saddest thing ive ever heard cheers,3
come again,3
silly rabbit my triumph isnt over her its over you,3
not my choice of toast but its your call to your triumph over annette,3
to my triumph of course,3
thank you now where were we,3
well done,3
not that its any of your business but yes,3
ronald,3
id love to but unfortunately im expecting some company,3
i thought we should celebrate,3
well done,3
devastated beyond repair i doubt shell ever trust a man again,3
annette,3
you wanted an answer to your question,3
mind if i ask what youre doing in my room,3
i have a flair for drama,3
a little melodramatic dont you think,3
i knew this guy last summer in the hamptons he and his girlfriend at the time were madly in love with each other but she had this huge weight problem his friends taunted him mercilessly about it you know how do you breathe when she sits on your face its embarrassing for you to be seen with her finally he couldnt take it anymore and decided to dump her she flipped and he went on the defensive i distinctly remember him saying the same thing over and over again im completely fucked up im completely fucked up im completely fucked up poor fatty never had a chance,3
screening calls any suggestions,3
how have you dumped girls in the past,3
ive never done this before,3
why so nervous,3
then do me a favor and get rid of her if not for me then do it for you look at yourself youre a joke shes turned you into jelly what do you want to be one of those losers who walk down the halls holding hands and smiling people used to respect you they feared you and now youre going to throw that all away,3
thats not fair youre taking all the fun out of it,3
is that what you think,3
i cant believe youre reacting this way youre just saying this because you lost the bet,3
not anymore you dont its obvious,3
kathryn you know i love you ive always loved you,3
at first it was but now its become something bigger,3
oh come on kathryn it was just a contest,3
im sorry its just upsetting youre in love with her you dont love me anymore,3
whats wrong with you why are you acting this way,3
pwhipped pwhipped,3
no im not,3
oh my god youre completely pwhipped,3
and i dont,3
i want to fuck,3
it clearly is why,3
and thats why youre leaving,3
im not in the mood,3
excuse me,3
some other time,3
mock mock mock,3
wow so you made love ooo i hear the birds chirping,3
it was it was like the emotional part outweighed the physical part,3
no tell me,3
i know thats the amazing part of it i mean it wasnt like cirque du soleil acrobatics just standard missionary stuff but it was ah forget it im going to sound like a hallmark card,3
oh come on for her first time,3
it was fantastic,3
tell me all the details,3
oh yes,3
you didnt,3
well you obviously wanted me to witness your little adventure or else you wouldnt have invited me in,3
kind of,3
bad time,3
she wouldnt say she apologized to your aunt and told her she was going to stay with some friends you blew it sebastian that girl has come to her senses and she will never go near you again,3
whered she go,3
you dont know she left thirty minutes ago,3
where is she,3
if youre heading towards her room you wont find her,3
a momentary lapse of judgment soon to be rectified,3
i dont know she was lying on the bed ready to do it but i i dont i was i just didnt feel right about it,3
so what went wrong,3
exactly the opposite,3
she shot you down,3
if your asking if i nailed her the answer is no,3
well i know how it went with cecile she wont shut up about it howd it go with mrs jesus,3
with who,3
so howd it go last night,3
morning,3
morning,3
kathryn the only thing youre going to be riding is me now if youll excuse me i have some work to do,3
do you mind if i take my new porsche for a ride,3
im not losing the bet its just taking longer than i expected,3
and thats why youre losing your bet,3
if you must know yes i dont know what to do i cant stand that holier than thou bullshit and yet im completely infatuated with her she made me laugh,3
shes really getting to you isnt she,3
nothing,3
whats your problem,3
shut up,3
jesus she reeks of laura ashley oh shes crying wittle babys upset by the big bad book,3
yeah,3
that her,3
take a look for yourself,3
who are you spying on,3
yippy,3
i just had a nice chat with cecile i dont think shell be giving you anymore problems,3
